{"$schema":"https://json-schema.org/draft/2020-12/schema","$id":"https://toesa.local/schemas/ai-weekly-report-analysis-v1.schema.json","title":"AI Weekly Report Analysis v1","type":"object","properties":{"schemaVersion":{"const":"ai-weekly-report-analysis.v1"},"analysisStatus":{"enum":["NORMAL","PARTIAL","NO_ACTION_REQUIRED"]},"executiveJudgment":{"type":"object","properties":{"headline":{"type":"string","minLength":1,"maxLength":160},"interpretation":{"type":"string","minLength":1,"maxLength":360},"metricRefs":{"type":"array","maxItems":4,"uniqueItems":true,"items":{"enum":["PERIOD_TASK_COUNT","COMPLETION_RATE","ON_TIME_RATE","DELAYED_COUNT","PERIOD_TASK_COUNT_DELTA","COMPLETION_RATE_DELTA","ON_TIME_RATE_DELTA","DELAYED_COUNT_DELTA"]}},"evidenceTaskRefs":{"type":"array","maxItems":5,"uniqueItems":true,"items":{"type":"string"}},"confidence":{"enum":["HIGH","MEDIUM","INSUFFICIENT_EVIDENCE"]},"missingEvidence":{"type":"array","maxItems":5,"items":{"type":"string","maxLength":100}}},"required":["headline","interpretation","metricRefs","evidenceTaskRefs","confidence","missingEvidence"],"additionalProperties":false},"achievement":{"type":"object","properties":{"status":{"enum":["AVAILABLE","NONE"]},"headline":{"type":"string","maxLength":180},"summary":{"type":"string","maxLength":260},"evidenceTaskRefs":{"type":"array","maxItems":5,"uniqueItems":true,"items":{"type":"string"}}},"required":["status","headline","summary","evidenceTaskRefs"],"additionalProperties":false},"issues":{"type":"array","maxItems":3,"items":{"type":"object","properties":{"priority":{"enum":["P1","P2","P3"]},"candidateRef":{"type":"string","minLength":1},"severity":{"enum":["HIGH","MEDIUM","LOW"]},"title":{"type":"string","minLength":1,"maxLength":80},"impact":{"type":"string","minLength":1,"maxLength":220},"confidence":{"enum":["HIGH","MEDIUM","INSUFFICIENT_EVIDENCE"]},"taskRefs":{"type":"array","minItems":1,"maxItems":5,"uniqueItems":true,"items":{"type":"string"}},"evidenceCodes":{"type":"array","minItems":1,"maxItems":8,"uniqueItems":true,"items":{"enum":["APPROVED_UNASSIGNED","REQUESTED_PENDING","OVERDUE","DUE_SOON","ON_HOLD","CHECKLIST_NOT_STARTED","CHECKLIST_STALLED","RESOURCE_MISSING","UNRESOLVED_MENTION","WORKLOAD_CONCENTRATION","NO_EFFORT_ESTIMATE","NO_COMPLETION_CRITERIA","CALENDAR_CONFLICT","COMPLETED","ON_TIME_COMPLETED"]}},"missingEvidence":{"type":"array","maxItems":5,"items":{"type":"string","maxLength":100}},"integratedJudgment":{"type":"string","minLength":1,"maxLength":320},"requiredDecision":{"type":"string","minLength":1,"maxLength":120},"decision":{"type":"object","properties":{"title":{"type":"string","minLength":1,"maxLength":120},"question":{"type":"string","minLength":1,"maxLength":180},"recommendedOptionCode":{"enum":["ASSIGN_OWNER_AND_SET_DUE","DEFINE_HOLD_EXIT_CRITERIA","DEFER_SCOPE","APPROVE_SCOPE","REQUEST_MORE_EVIDENCE","REBALANCE_WORK","KEEP_CURRENT_PLAN"]},"recommendation":{"type":"string","minLength":1,"maxLength":260},"decisionMakerRole":{"enum":["LEADER","GROUP_ADMIN"]},"actionOwnerRole":{"enum":["SELECTED_MEMBER","CURRENT_ASSIGNEE","REQUESTER","LEADER","TEAM"]},"deadline":{"type":"object","properties":{"source":{"enum":["MEETING_END","CALENDAR_EVENT","TASK_DUE","LEADER_DECISION_REQUIRED"]},"referenceRef":{"type":["string","null"]}},"required":["source","referenceRef"],"additionalProperties":false},"executionStepCodes":{"type":"array","minItems":1,"maxItems":6,"uniqueItems":true,"items":{"enum":["ASSIGN_OWNER","SET_DUE","START_CHECKLIST","LINK_RESOURCE","RESOLVE_MENTION","SET_HOLD_EXIT_CRITERIA","RESUME_TASK","RECORD_SCOPE_DECISION","SET_NEXT_REVIEW_DATE","REBALANCE_ASSIGNEE"]}},"completionSignalCodes":{"type":"array","minItems":1,"maxItems":6,"uniqueItems":true,"items":{"enum":["ASSIGNEE_SET","DUE_AT_SET","CHECKLIST_STARTED","RESOURCE_LINKED","MENTION_RESOLVED","HOLD_STATE_RECORDED","TASK_RESUMED","SCOPE_DECISION_RECORDED","NEXT_REVIEW_DATE_SET"]}}},"required":["title","question","recommendedOptionCode","recommendation","decisionMakerRole","actionOwnerRole","deadline","executionStepCodes","completionSignalCodes"],"additionalProperties":false}},"required":["priority","candidateRef","severity","title","impact","confidence","taskRefs","evidenceCodes","missingEvidence","integratedJudgment","requiredDecision","decision"],"additionalProperties":false}},"globalMissingEvidence":{"type":"array","maxItems":8,"items":{"type":"string","maxLength":120}}},"required":["schemaVersion","analysisStatus","executiveJudgment","achievement","issues","globalMissingEvidence"],"additionalProperties":false}